{
  "annotation_files": [],
  "bag": {
    "duration_ns": 51560177995,
    "relative_path": "rosbags/human_tracking/recordings/human_tracking_lidar_20260706_150711",
    "sha256": "a31c757c35796af3e682037f6f87c87586f90dc159298df7a06323fcc982b02a",
    "start_time_ns": 1783346832943161270,
    "storage_id": "sqlite3",
    "topics": [
      {
        "count": 1032,
        "name": "/rslidar_points",
        "type": "sensor_msgs/msg/PointCloud2"
      },
      {
        "count": 19566,
        "name": "/tf",
        "type": "tf2_msgs/msg/TFMessage"
      },
      {
        "count": 997,
        "name": "/tf_static",
        "type": "tf2_msgs/msg/TFMessage"
      },
      {
        "count": 742,
        "name": "/zed/zed_node/left/camera_info",
        "type": "sensor_msgs/msg/CameraInfo"
      },
      {
        "count": 742,
        "name": "/zed/zed_node/left/image_rect_color",
        "type": "sensor_msgs/msg/Image"
      }
    ]
  },
  "calibration": {
    "camera_intrinsics_id": "recorded_camera_info",
    "camera_lidar_extrinsics_id": "unverified_legacy_tf",
    "lidar_imu_extrinsics_id": "unknown",
    "localization_config_id": "none"
  },
  "capabilities": {
    "active_motion": false,
    "annotations": false,
    "camera": true,
    "imu": false,
    "lidar": true,
    "local_pose": false,
    "query_events": false,
    "world_pose": false
  },
  "dataset_id": "human_tracking_lidar_20260706_150711",
  "environment": {
    "lighting": "unknown",
    "session_id": "human_tracking_lidar_20260706_150711",
    "site_id": "legacy_unknown",
    "surface": "unknown",
    "weather": "unknown"
  },
  "objects": [],
  "provenance": {
    "created_at": "2026-07-15T02:22:11.335182Z",
    "created_by": "semantic_search_manifest",
    "notes": "Legacy human-tracking bag; observation-only replay evidence."
  },
  "queries": [],
  "schema_version": "1.0.0",
  "split": "legacy_replay_only",
  "trials": []
}
